### ISSUE TITLE
unexpected A record in DNS response (reported in nginx container)

### ISSUE THREAD

**Issue by jhollmannk** [rancher-sandbox/rancher-desktop#3447]
### Actual Behavior

This is a bit complicated, sorry.

A nginx container reports "unexpected A record in DNS response" when the host resolving is done at runtime (not at configuration load time).

When you use a variable in a proxy_pass statement nginx will resolve the host at runtime. You have to set a resolver in your configuration, in this case 127.0.0.11 in a docker environment. Doing this results in the above error message and the host cannot be found.

### Steps to Reproduce

Save this as the nginx.conf somewhere (d:\temp\nginxtest):

> worker_processes 1;
> events {
>   worker_connections 1024;
> }
> http {
>   server {
>   	listen 80 default_server;
>     resolver 127.0.0.11;
>     location /headers/path1/ {
>       proxy_pass http://host.docker.internal:29103$request_uri;
>     }
>   }
> }
> 

Now create a network: 
`docker network create testnet`

and start an nginx container with the given nginx.conf:
`docker run --rm --name nginx -v D:\temp\nginxtest\nginx.conf:/etc/nginx/nginx.conf -p8080:80 --net testnet nginx:stable`

Now make a HTTP call to the running nginx:
`curl localhost:8080/headers/path1/`

### Result

In the container log you can see the error messages:

> 2022/11/23 09:34:41 [error] 29#29: unexpected A record in DNS response
> 2022/11/23 09:34:46 [error] 29#29: unexpected A record in DNS response
> 2022/11/23 09:34:51 [error] 29#29: unexpected A record in DNS response
> 2022/11/23 09:34:56 [error] 29#29: unexpected A record in DNS response
> 2022/11/23 09:35:01 [error] 29#29: unexpected A record in DNS response
> 2022/11/23 09:35:06 [error] 29#29: unexpected A record in DNS response
> 2022/11/23 09:35:11 [error] 29#29: *1 host.docker.internal could not be resolved (110: Operation timed out), client: 172.20.0.1, server: , request: "GET /headers/path1/ HTTP/1.1", host: "localhost:8080"
> 172.20.0.1 - - [23/Nov/2022:09:35:11 +0000] "GET /headers/path1/ HTTP/1.1" 502 157 "-" "curl/7.83.1"

This happens with any host not just host.docker.internal. Nginx returns a Bad Gateway (502).

### Expected Behavior

The host should be resolved.

### Additional Information

If you add dnsutils in the container with `apt update` and `apt install dnsutils` you can check with nslookup or dig that the host is resolvable:

> nslookup host.docker.internal
> Server:         127.0.0.11
> Address:        127.0.0.11#53
> 
> Non-authoritative answer:
> Name:   host.docker.internal
> Address: 192.168.224.1
> Name:   host.docker.internal
> Address: 192.168.224.1

Also if the host is resolved at configuration load time (just omit the `$request_uri` in the nginx.conf so that no variables are used in the proxy_pass statement and delete the resolver statement) the host is resolved just fine.

I don't know what nginx does here differently but as you just worked on DNS resolving I thought maybe you can look into that and see what nginx asks the DNS resolver in this case.

### Rancher Desktop Version

1.6.1

### Rancher Desktop K8s Version

1.24.3

### Which container engine are you using?

moby (docker cli)

### What operating system are you using?

Windows

### Operating System / Build Version

Windows 10 Enterprise

### What CPU architecture are you using?

x64

**Comment by adamkpickering** [comment]
I am able to reproduce this on Windows 10 with RD 1.6.2.

> maybe you can look into that and see what nginx asks the DNS resolver in this case

Remember that there are ~700 issues in our backlog, so it may take a while, unless this is a common issue. Any details you can figure out yourself help a lot in solving this.

@Nino-K do you have any idea what could be causing this?

**Comment by torbenaa** [comment]
Same issue with Rancher Desktop 1.6.2 on MacOS 13.0.1

**Comment by Nino-K** [comment]
@jhollmannk thanks for filing this issue. After taking a close look at the TCP dump output I can see that nginx resolver is making two requests one for A record (IPv4) and the other one for AAAA record (IPv6), however, DNS server replies to both queries as A response as you can see below which is causing the error `unexpected A record in DNS response`.

```
22:12:29.390672 IP 172.19.0.2.33137 > 172.17.235.101.53: 8394+ AAAA? host.docker.internal. (38)
22:12:29.390675 IP 172.19.0.2.48406 > 172.17.235.101.53: 50518+ A? host.docker.internal. (38)
22:12:29.391876 IP 172.17.235.101.53 > 172.19.0.2.33137: 8394- 1/0/0 A 172.17.224.1 (74)
22:12:29.392013 IP 172.17.235.101.53 > 172.19.0.2.48406: 50518- 1/0/0 A 172.17.224.1 (74)
```
This is something that we would need to fix on our end, however, it will not be part of this upcoming release `1.7.0` (in a few days). It will have to go into `1.8.0`.

Meanwhile, to bypass this issue you can disable the IPv6 on your resolver like below:
```
resolver 127.0.0.11 ipv6=off;
```

**Comment by jhollmannk** [comment]
Wow! Thank you for looking in to this. I can't make heads or tails of the tcpdump.
And I can do with the workaround until 1.8.0.
Looking forward to it!

**Comment by Nino-K** [comment]
@jhollmannk the fix is in place now, can you give it a try when `1.8.0` is out? I'm going to close this issue, feel free to re-open it if you encounter anything additional. Thanks again for reporting this.
